{
  "$schema": "https://testatlas.dev/schemas/v1/evidence.schema.json",
  "id": "EVIDENCE-001",
  "type": "file",
  "path": "evidence/EVIDENCE-001/capture.bin",
  "domain": null,
  "flow": null,
  "issue": null,
  "capturedOn": "2026-05-03T00:00:00.000Z",
  "environment": "local",
  "description": "Snapshot of app/api/auth/login/route.js returning the literal token mock-jwt-token",
  "redacted": false
}
