{
  "$schema": "https://testatlas.dev/schemas/v1/evidence.schema.json",
  "id": "EVIDENCE-002",
  "type": "log",
  "path": "evidence/EVIDENCE-002/capture.bin",
  "domain": null,
  "flow": null,
  "issue": null,
  "capturedOn": "2026-05-03T00:00:00.000Z",
  "environment": "local",
  "description": "GET /api/items response showing the entire array with no offset/limit support",
  "redacted": false
}
