{
  "$schema": "https://testatlas.dev/schemas/v1/evidence.schema.json",
  "id": "EVIDENCE-001",
  "type": "log",
  "path": "evidence/EVIDENCE-001/capture.bin",
  "domain": null,
  "flow": null,
  "issue": null,
  "capturedOn": "2026-05-03T00:00:00.000Z",
  "environment": "local",
  "description": "ab -n 5000 -c 50 trace showing POST /api/items accepts every request",
  "redacted": false
}
