{
  "$schema": "https://testatlas.dev/schemas/v1/evidence.schema.json",
  "id": "EVIDENCE-001",
  "type": "log",
  "path": "evidence/EVIDENCE-001/capture.bin",
  "domain": null,
  "flow": null,
  "issue": null,
  "capturedOn": "2026-05-03T00:00:00.000Z",
  "environment": "local",
  "description": "curl trace showing DELETE /api/tasks/1 succeeds without an auth header",
  "redacted": false
}
